Nome,ticker,valor,resumo_final,tag1,tag2,tag3,tag4,tag5
Even,even3,https://www.even.com.br,"Even is a leading vertically integrated construction and real estate development company in Brazil, publicly listed on the Bovespa stock exchange. With over 40 years in the industry, Even specializes in high-end and luxury residential and commercial projects primarily in the western and southern regions of São Paulo city. The company offers comprehensive services covering the entire development process from land prospecting and property incorporation to construction and sales. Even is recognized for pioneering sustainability and ESG initiatives in the sector and incorporates pet-friendly environments and smart home technology within its projects. Main product offerings include high-standard residential and commercial real estate developments with customization options (through its Studio Excluseven), smart home solutions, and full-service real estate sales via its own agencies, EvenVendas and EvenMore. The company also maintains strong compliance policies and customer service channels and supports a robust supplier network and talent development programs.","['Real Estate', 'Consumer Discretionary']",['Land and Buildings and Structures and Thoroughfares'],['Permanent buildings and structures'],"['Commercial and entertainment buildings and structures', 'Accommodation buildings and structures']","['Flat or apartment', 'Residential home', 'Shop building', 'Shopping center']"
Tegma,tgma3,https://www.tegma.com.br,"Tegma Gestão Logística is a leading Brazilian logistics company with over 55 years of experience, specializing in complex and high-criticality operations, particularly in integrated logistics and automotive logistics. It holds a significant market share in transporting zero-kilometer vehicles in Brazil and operates a vast network of strategically located facilities. Tegma offers a comprehensive range of services including yard management via YMS for automakers and fleet operators, vehicle storage with extensive secured patio space, vehicle transportation, automotive center services such as oil changes and tire checks, and handling inbound and outbound logistics for the chemical and petrochemical industries. Its logistics integrated services encompass supply chain management for chemicals, packaging management, intralogistics, and special projects. Tegma is also committed to innovation through its corporate venture capital arm, tegUP, focusing on startup acceleration and digital transformation, including implementing AI and technology solutions for efficiency. The company adheres to sustainability principles (ASG/ESG), with certifications like Great Place to Work, and maintains rigorous compliance and governance standards.","['Industrials', 'Consumer Discretionary']","['Transportation and Storage and Mail Services', 'Industrial Production and Manufacturing Services', 'Management and Business Professionals and Administrative Services', 'Engineering and Research and Technology Based Services']","['Transport services', 'Passenger transport', 'Mail and cargo transport', 'Material packing and handling', 'Storage']","['Logistics operation management', 'Transport arranging services', 'Material handling services', 'General goods storage', 'Automotive logistics']","['Freight forwarders services', 'Transportation industry tariff comparison or freight audit services', 'Supplier or vendor managed freight and rebilling']"
Brisanet,brst3,https://www.brisanet.com.br,"Brisanet is a telecommunications company based in Brazil, primarily serving the northeastern region with a presence in more than 150 cities and over 1.2 million customers. The company offers a range of services including 100% fiber optic internet, mobile and fixed telephony services with 5G technology, and entertainment services such as streaming of movies, live channels, and music. Brisanet provides customer support through various channels including an app for account management, remote assistance, and an ombudsman for complaint handling and feedback. The company focuses on providing reliable, modern connectivity solutions to promote digital inclusion and social impact in its service areas.",['Communication Services'],['Information Technology Broadcasting and Telecommunications'],"['Communications Devices and Accessories', 'Software', 'Data Voice or Multimedia Network Equipment or Platforms and Accessories']","['Telephony equipment', 'Telephony equipment accessories', 'Network service equipment', 'Digital mobile network infrastructure equipment and components']","['Telecommunication equipment installation or modification kits', 'Network routers', 'Network switches', 'Internet protocol IP multimedia subsystem hardware', 'Broadband aggregators']"
Trisul,tris3,https://www.trisul-sa.com.br,"Trisul is a Brazilian real estate development company with over 40 years of experience in civil construction. It specializes in medium and high-standard residential projects, having launched more than 300 developments with 60,000 units delivered, mainly in São Paulo and other cities in the state as well as the federal district. The company focuses on quality, technological innovation, competitive pricing, and timely delivery. Trisul operates in key segments of the real estate value chain including land acquisition, project development, construction, and sales through its own sales team. They offer a portfolio of apartments and studios ranging from studios to multi-bedroom units in various São Paulo neighborhoods, including projects at different stages such as pre-launch, under construction, and ready to move in. The company is also committed to sustainability, holding certifications like AQUA and the Procel Seal for energy efficiency, implementing sustainable construction practices, and contributing positively to communities. Trisul is publicly listed on the Novo Mercado segment of Bovespa, adhering to strong corporate governance, transparency, and customer satisfaction principles.",['Real Estate'],['Land and Buildings and Structures and Thoroughfares'],"['Permanent buildings and structures', 'Land parcels']","['Accommodation buildings and structures', 'Residential land parcel']","['Flat or apartment', 'Condominium parcel', 'Housing subdivision parcel', 'Apartment building parcel', 'Single family home parcel']"
Track & Field,tfco4,https://www.statusinvest.com.br,"Status Invest is a financial investment platform that provides comprehensive tools, information, and services related to various investment assets primarily in the Brazilian and international markets. The company offers detailed data, analytics, and insights on stocks, real estate investment trusts (REITs), exchange-traded funds (ETFs), fixed income, cryptocurrencies, and other financial instruments. Its services include advanced search and analysis functionalities for stocks, IPOs, FIIs (Brazilian real estate funds), investment funds (FIAs, FIDCs, FIPs, FI-Infra, Fiagros), BDRs, Treasury bonds, and market indexes. Status Invest also offers personalized financial advisory services with several tiers of investment advisory plans (on-demand, exclusive, premium, private), designed to provide portfolio mapping, goal alignment, continuous monitoring by dedicated advisors, and fixed transparent fees. The advisory service emphasizes client-aligned interests and certified professional support to enhance investment strategies and growth. In addition, the platform features real-time data updates, dividend information, event calendars, and educational content like investment courses. Overall, Status Invest operates as a comprehensive investment management and advisory platform aiming to centralize investment tracking, provide research tools, and offer tailored financial advice to help investors make informed decisions and grow their wealth.",['Financials'],"['Financial Instruments, Products, Contracts and Agreements', 'Financial and Insurance Services']","['Banking and investment', 'Securities', 'Insurance and retirement services']","['Investment advice', 'Securities and commodities markets services', 'Funds transfer and clearance and exchange services']","['Investment analysis', 'Financial asset management service', 'Investment advisers', 'Market data', 'Investment policy']"
HBR Realty,hbre3,https://www.hbrrealty.com.br,"HBR Realty is a real estate company founded in 2011 and part of the Hélio Borenstein holding. It operates in the development and management of retail and corporate real estate assets across Brazil. The company has a diverse portfolio with more than 46 developments and over 1,300 stores in 18 Brazilian cities. HBR Realty offers solutions through four main strategic platforms: ComVem, which develops convenience centers in densely populated and affluent areas; HBR Malls, focused on acquiring and managing shopping centers; HBR 3A, dedicated to development and administration of high-standard (AAA) corporate office spaces in premium locations in São Paulo; and HBR Opportunities, which manages complementary assets with high investment potential, including hotels, parking facilities within multiuse buildings, self-storage services, and built-to-suit and sale-leaseback solutions. The company emphasizes intelligent business dealings and innovation, with a business model covering the entire urban asset value cycle from development to portfolio recycling. Since January 2021, HBR Realty is listed on B3, the Brazilian stock exchange.",['Real Estate'],['Land and Buildings and Structures and Thoroughfares'],"['Permanent buildings and structures', 'Portable buildings and structures']","['Commercial and entertainment buildings and structures', 'Utility buildings and structures', 'Accommodation buildings and structures']","['Shopping mall', 'Shopping center', 'Parking structure', 'Shop building']"
Eternit,eter3,https://www.eternit.com.br,"Eternit S.A is a Brazilian company specializing in construction materials, particularly fiber cement products. Their main products and services include fiber cement roof tiles suitable for various types of construction, complementary parts for precise finishing to prevent leaks, and a range of accessories for maintaining roofs. They also offer an innovative product line called Linha Pratic for seamless joints in cement sheets, as well as various types of cement sheets (Eterplac) with thermal and acoustic insulation properties ideal for wet areas and facades. Additionally, they provide the Painel Wall, a sustainable construction panel for walls and floors with easy installation, and Eterplac Tapume for temporary constructions and construction site enclosures. Their portfolio includes Eterpiso, a fiber cement panel for floor construction offering high durability. They are also engaged in the photovoltaic segment with Eternit Solar, a fiber cement solar roof tile capable of converting solar radiation into electricity, featuring high durability and easy installation similar to traditional roofing tiles. The company emphasizes innovation, quality, and sustainability in their offerings and has a wide distribution network throughout Brazil.","['Consumer Discretionary', 'Materials']","['Mineral and Textile and Inedible Plant and Animal Materials', 'Furniture and Furnishings']","['Non edible plant and forestry products', 'Fibers and threads and yarns', 'Fabrics and leather materials']","['Fiber cement products', 'Engineered wood products', 'Fabrics of vegetable material other than cotton', 'Nonwoven fabrics']","['Medium density fiberboard', 'Glued laminated timber']"
Klabin,klbn3,https://www.klabin.com.br,"Klabin is a leading Brazilian company with over 126 years of history, specializing in sustainable forestry management and the production of paper, pulp, and packaging solutions. It operates integrated processes from forest cultivation to manufacturing, ensuring responsible and eco-friendly practices. The company manages planted forests of pine and eucalyptus across the states of Paraná, Santa Catarina, and São Paulo, maintaining high environmental conservation standards with 41% of its forest areas preserved. Klabin's main products and services include various types of cellulose (long fiber, short fiber, fluff), papers (kraftliner, sack kraft, paperboard, recycled papers), and packaging solutions such as bags and boxes tailored for different industries including agribusiness, animal feed, food and beverages, construction, e-commerce, hygiene and cleaning, electronics, and mining. Klabin also offers customized and e-commerce packaging solutions. The company is committed to innovation, sustainability, and circular economy principles, using renewable raw materials and aiming to minimize environmental impacts through efficient energy and water use, waste recycling, and reduction of greenhouse gas emissions. Additionally, Klabin supports community development programs, research in forestry, and promotes diversity and integrity within its workforce.","['Materials', 'Consumer Discretionary']","['Paper Materials and Products', 'Chemicals including Bio Chemicals and Gas Materials']","['Paper materials', 'Paper products', 'Industrial use papers']","['Raw materials', 'Paperboard and packaging papers', 'Coated papers', 'Uncoated base papers']","['Paper pulp', 'Bleached paperboard', 'Unbleached paperboard', 'Packaging paper', 'Cardboard']"
Portobello,ptbl3,https://www.portobello.com.br,"Portobello is a leading Brazilian company specializing in ceramic coatings and innovative design solutions for interiors and exteriors. It operates through four business units: Portobello (ceramic product manufacturing and distribution), Portobello Shop (a network of 163 retail stores offering exclusive products and customer service across Brazil), Pointer (sustainable production and design-focused brand based in northeastern Brazil), and Portobello America (their international expansion with distribution and a manufacturing plant in Tennessee, USA). The company's product range includes various types of ceramic coatings like porcelain slabs (lastras), tiles, finishes, installation products, metals, sanitary ware, drainage solutions, and post-installation maintenance items. Portobello is committed to sustainability, utilizing responsible resource management such as water reuse, energy efficiency, waste recycling, and environmental preservation in raw material extraction. It exports to over 80 countries and aims to integrate design, innovation, and sustainability in its operations while serving architects, designers, final consumers, home centers, real estate, and large construction projects.","['Consumer Discretionary', 'Materials']","['Furniture and Furnishings', 'Domestic Appliances and Supplies and Consumer Electronic Products']","['Decorative adornments', 'Domestic wall treatments', 'Floor coverings']",['Ceramic adornments'],"['Ceramic plate or platter', 'Ceramic bowl', 'Ceramic vase']"
Wiz Soluções,wizc3,https://www.wizsolucoes.com.br,"Wiz is a company that provides risk management and insurance solutions, aiming to simplify and integrate these services for their clients. They offer a blend of technology and specialized consulting to help businesses manage their risks effectively.","['Financials', 'Information Technology']",['Financial and Insurance Services'],['Insurance and retirement services'],"['Insurance services for structures and property and possessions', 'Insurance services for casualty lines']","['Reinsurance services', 'Business interruption insurance', 'Professional indemnity insurance']"
Lavvi Incorporadora,lavv3,https://www.lavvi.com.br,"Lavvi Empreendimentos Imobiliários S/A is a real estate company in São Paulo, Brazil, known for delivering high-standard residential developments. Founded as part of the Grupo Cyrela, a reputable name in the real estate sector, Lavvi emphasizes quality, innovation, and customer satisfaction. Their mission is to build excellent projects that help realize dreams by offering comfort, leisure, and well-being. They focus on sophisticated projects in strategic locations, aiming for excellence in quality and commitment to residents' lives. The company offers residential real estate developments including apartments, residences, and studios, with various projects across regions such as São Caetano, Brooklin, Chácara Klabin, Luz, and others in São Paulo. They provide services including property sales, financial consultation, progress tracking of real estate construction, and customer support via a user portal. They maintain strong commitments to data privacy, quality management, and transparent communication with clients.",['Real Estate'],['Land and Buildings and Structures and Thoroughfares'],"['Permanent buildings and structures', 'Land parcels']","['Residential land parcel', 'Accommodation buildings and structures']","['Apartment building parcel', 'Condominium parcel', 'Single family home parcel', 'Residential home']"
BR Partners,brbi11,https://www.investidor10.com.br,"Investidor10 is a Brazilian online financial platform aimed at investors interested in long-term investment strategies, particularly in the 'Buy and Hold' approach. The platform offers comprehensive tools, educational content, and financial analysis to assist investors in managing and optimizing their portfolios. Key services and products include a portfolio manager with integration to B3 (the Brazilian Stock Exchange), advanced filtering and comparison tools for assets like stocks, real estate funds (FIIs), cryptocurrencies, and international investments. It provides extensive market data, rankings, dividend schedules, tax assistance tools (IRPF), and a wide range of investment courses covering stocks, fixed income, cryptocurrencies, real estate funds, and financial literacy. Investidor10 also offers a PRO subscription with enhanced features such as exclusive reports, recommended portfolios, and integration capabilities to facilitate investment decisions and reporting. The platform's content is informational and educational, designed to empower investors with knowledge and tools needed for making well-informed long-term investment decisions.","['Financials', 'Consumer Discretionary']","['Financial Instruments, Products, Contracts and Agreements', 'Financial and Insurance Services', 'Education and Training Services']","['Bank offered products', 'Securities', 'Banking and investment', 'Educational institutions', 'Specialized educational services', 'Alternative educational systems']","['Investment accounts', 'Investment advice', 'Equity based securities', 'Debt based securities', 'Securities and commodities markets services']","['Education savings account', 'Investment advisers', 'Investment analysis', 'Market data', 'Basic investment account']"
Gafisa,gfsa3,https://www.gafisa.com.br,"Gafisa is one of Brazil's largest real estate developers and construction companies with over 70 years of experience. It has completed more than 1,200 projects spanning over 16 million square meters, mainly focusing on high-end residential and commercial real estate. Their portfolio includes residential apartments, commercial buildings, hotel properties, and planned communities across more than 40 Brazilian cities. Gafisa offers services in real estate development, construction, sales, and investment opportunities. The company emphasizes innovation, sustainability, and strong community relations, and is publicly traded on the Brazilian stock exchange (B3).",['Real Estate'],['Land and Buildings and Structures and Thoroughfares'],"['Permanent buildings and structures', 'Prefabricated buildings and structures']","['Accommodation buildings and structures', 'Commercial and entertainment buildings and structures']","['Flat or apartment', 'Residential home', 'Shopping center']"
Sanepar,sapr3,https://www.sanepar.com.br,"Sanepar, Companhia de Saneamento do Paraná, is a Brazilian company specializing in public water supply, sewage collection and treatment, and solid waste management. It provides treated water to residential, commercial, and industrial customers, collects and treats sewage including sludge disposal, and manages organic waste. The company emphasizes sustainability, social responsibility, transparency, and innovation in its operations. Services include new water and sewage connections, maintenance, digital account management, and dedicated customer support. Sanepar serves municipalities, large clients (industries, condominiums, commerce), and public authorities, aiming to achieve universal coverage of water and sewage services in Paraná state. Additionally, it promotes environmental education, diversity and inclusion, data privacy, and partnerships for technological development. The company offers digital platforms to facilitate customer interaction and payment, and actively invests in infrastructure projects to enhance service quality and environmental protection.",['Utilities'],['Public Utilities and Public Sector Related Services'],['Utilities'],['Water and sewer utilities'],"['Supply of water', 'Water distribution management', 'Sewage collection and treatment', 'Water treatment services', 'Service water']"
Mahle Metal Leve,leve3,https://www.mahle.com.br,"MAHLE is a leading international automotive technology company, founded in 1920, that develops and supplies components primarily for passenger cars and commercial vehicles. The company focuses on sustainable, climate-neutral mobility solutions including electrification, thermal management, fuel cells, and efficient combustion engines using renewable fuels like hydrogen. MAHLE's product range includes electric drive systems, electrical auxiliaries, electronics, air conditioning, air and oil management, cooling systems, cylinder components, fuel management, mechatronics, piston systems, valve trains, and e-bike systems. They also provide services such as climatic wind tunnel testing, engine testing, engineering, module testing, thermal management services, and transmissions. Additionally, MAHLE offers aftermarket parts and services for trade partners, workshops, and repair shops, leveraging expertise in electrification and digitalization. The company operates globally with extensive R&D centers and production sites, serving clients worldwide with components found in one out of every two vehicles globally.","['Industrials', 'Consumer Discretionary']","['Vehicles and their Accessories and Components', 'Industrial Production and Manufacturing Services', 'Engineering and Research and Technology Based Services']","['Motor vehicles', 'Transportation components and systems', 'Manufacturing technologies', 'Machinery and transport equipment manufacture', 'Professional engineering services']","['Passenger motor vehicles', 'Manufacture of transport equipment', 'Electric vehicle charging systems', 'Environmental control systems', 'Drivetrain systems', 'Research and development innovation and technology services']","['Motor vehicles manufacture services', 'Motor vehicles parts or accessories manufacture services', 'Electrically powered vehicle', 'Electric vehicle charging station', 'Hydrogen powered vehicle', 'Hydrogen passenger cars', 'Electric drive systems', 'Electric auxiliaries', 'Fuel cells']"
Technos,tecn3,https://www.statusinvest.com.br,"Status Invest is a financial investment platform that provides comprehensive tools, information, and services related to various investment assets primarily in the Brazilian and international markets. The company offers detailed data, analytics, and insights on stocks, real estate investment trusts (REITs), exchange-traded funds (ETFs), fixed income, cryptocurrencies, and other financial instruments. Its services include advanced search and analysis functionalities for stocks, IPOs, FIIs (Brazilian real estate funds), investment funds (FIAs, FIDCs, FIPs, FI-Infra, Fiagros), BDRs, Treasury bonds, and market indexes. Status Invest also offers personalized financial advisory services with several tiers of investment advisory plans (on-demand, exclusive, premium, private), designed to provide portfolio mapping, goal alignment, continuous monitoring by dedicated advisors, and fixed transparent fees. The advisory service emphasizes client-aligned interests and certified professional support to enhance investment strategies and growth. In addition, the platform features real-time data updates, dividend information, event calendars, and educational content like investment courses. Overall, Status Invest operates as a comprehensive investment management and advisory platform aiming to centralize investment tracking, provide research tools, and offer tailored financial advice to help investors make informed decisions and grow their wealth.",['Financials'],"['Financial Instruments, Products, Contracts and Agreements', 'Financial and Insurance Services']","['Banking and investment', 'Securities']","['Investment advice', 'Securities and commodities markets services', 'Funds transfer and clearance and exchange services']","['Investment advisers', 'Investment analysis', 'Financial asset management service', 'Investment policy', 'Market data']"
