Nome,ticker,valor,resumo_final,tag1,tag2,tag3,tag4,tag5
Equatorial Energia Pará,eqpa3,https://www.equatorialenergia.com.br,"Grupo Equatorial is a Brazilian company operating in the energy sector. It serves multiple states including Alagoas, Amapá, Goiás, Maranhão, Pará, Piauí, and Rio Grande do Sul. The company focuses on electricity distribution and related services, providing energy solutions to various regions within Brazil.",['Energy'],['Mining and oil and gas services'],['Oil and gas exploration services'],['Other logging services'],['General well logging services']
Jereissati Participações,igti3,https://www.jereissati.com.br,"Iguatemi S.A. is a Brazilian company specializing in the development, ownership, and management of shopping centers. Founded in 1979, it operates premium shopping malls located in high-income regions such as São Paulo, Rio de Janeiro, Rio Grande do Sul, Brasília, and Santa Catarina. The company is recognized for pioneering the shopping center sector in Brazil and for hosting luxury brands. Its main services and products include the development and operation of shopping centers, multi-use complexes combining retail, commercial towers, residential projects, and hotels, as well as acquisition and expansion of existing shopping centers. Iguatemi S.A. also operates a digital marketplace, Iguatemi 365, enhancing the omnichannel retail experience. The company is listed on the Brazilian stock exchange B3 under the ticker IGTI11 and is committed to sustainability practices and corporate governance standards.","['Consumer Discretionary', 'Real Estate']","['Land and Buildings and Structures and Thoroughfares', 'Travel and Food and Lodging and Entertainment Services', 'Organizations and Clubs']","['Permanent buildings and structures', 'Commercial sports', 'Hotels and lodging and meeting facilities', 'Travel facilitation']","['Commercial and entertainment buildings and structures', 'Accommodation buildings and structures']","['Shopping mall', 'Shopping center']"
Alupar,alup3,https://www.alupar.com.br,"Alupar is a private Brazilian holding company established in 2007 that operates in the energy sector across Brazil and Latin America. The company focuses on energy transmission and generation, managing 35 transmission systems totaling 8,805 km of lines with 30-year concessions. It operates in Brazil, Peru, Colombia, and Chile, controlling hydroelectric plants (UHEs), small hydropower plants (PCHs), wind farms, and a photovoltaic plant with a total installed capacity of 798.5 MW, emphasizing renewable energy. Alupar's subsidiaries include numerous transmission companies covering various regions in Brazil and Latin America. The company also has a commercial arm, Alup, for selling energy to consumers via the free energy market. Alupar prioritizes sustainability and social responsibility, implementing environmental programs, community engagement, and supporting social projects. They adhere to international principles on human rights, labor, environment, and anti-corruption through their commitment to the UN Global Compact. Main services and products include electric power transmission infrastructure, renewable energy generation (hydroelectric, wind, solar), and energy commercialization.",['Energy'],['Mining and oil and gas services'],"['Oil and gas extraction and production enhancement services', 'Oil and gas restoration and reclamation services', 'Oil and gas laboratory testing services']",['Other oilfield pumping services'],['None of the options provided apply']
Sansuy,snsy5,https://www.sansuy.com.br,"Sansuy is a 100% Brazilian company founded in 1966, specializing in the manufacture and sale of flexible PVC laminates and manufactured PVC products. It serves multiple industrial sectors including automotive, logistics, storage, visual communication, environmental protection, agribusiness (both agriculture and aquaculture), among others. Sansuy offers a diverse product range such as PVC laminates (simple, reinforced, supported, expanded), high-pressure hoses for agricultural spraying, geomembranes for waterproofing, silos, cover solutions for cotton bales and implements, tanks for aquaculture, modular warehouses, PVC fabrics for banners and signage, industrial coatings, and specialized materials for the offshore and construction sectors. Sanuy is recognized for quality certifications like ISO 9001:2015 and IATF 16949:2016, holding leadership in South America in PVC lamination manufacturing with a strong emphasis on sustainable practices and innovation. The company is involved in various markets such as agribusiness, storage and logistics, architecture and decoration, coverings, communication, construction, industry, offshore sector, and transportation.","['Materials', 'Industrials', 'Consumer Discretionary']","['Chemicals including Bio Chemicals and Gas Materials', 'Industrial Manufacturing and Processing Machinery and Accessories', 'Manufacturing Components and Supplies']","['Additives', 'Compounds and mixtures', 'Raw materials processing machinery', 'Fabricated structural assemblies', 'Fabricated sheet assemblies']","['Plasticizers', 'Waterproofing agents', 'Industrial antiseptics', 'Chemical scavengers', 'Adhesives', 'Organic derivatives and substituted compounds', 'Inorganic compounds']","['Polymerics', 'PVC fabrics', 'Geomembranes', 'Agricultural oils', 'Industrial coatings']"
Alphaville,avll3,https://www.statusinvest.com.br,"Status Invest is a financial investment platform that provides comprehensive tools, information, and services related to various investment assets primarily in the Brazilian and international markets. The company offers detailed data, analytics, and insights on stocks, real estate investment trusts (REITs), exchange-traded funds (ETFs), fixed income, cryptocurrencies, and other financial instruments. Its services include advanced search and analysis functionalities for stocks, IPOs, FIIs (Brazilian real estate funds), investment funds (FIAs, FIDCs, FIPs, FI-Infra, Fiagros), BDRs, Treasury bonds, and market indexes. Status Invest also offers personalized financial advisory services with several tiers of investment advisory plans (on-demand, exclusive, premium, private), designed to provide portfolio mapping, goal alignment, continuous monitoring by dedicated advisors, and fixed transparent fees. The advisory service emphasizes client-aligned interests and certified professional support to enhance investment strategies and growth. In addition, the platform features real-time data updates, dividend information, event calendars, and educational content like investment courses. Overall, Status Invest operates as a comprehensive investment management and advisory platform aiming to centralize investment tracking, provide research tools, and offer tailored financial advice to help investors make informed decisions and grow their wealth.",['Financials'],"['Financial Instruments, Products, Contracts and Agreements', 'Financial and Insurance Services']","['Banking and investment', 'Securities', 'Insurance and retirement services']","['Investment advice', 'Securities and commodities markets services', 'Funds transfer and clearance and exchange services']","['Investment advisers', 'Investment analysis', 'Financial asset management service', 'Market data']"
Energisa,engi4,https://www.energisa.com.br,"Energisa is a leading Brazilian energy company with over 120 years of history, providing energy distribution, transmission, generation, and innovative energy solutions across various Brazilian states. Their services span residential and commercial customers, offering electricity supply, renewable energy projects (solar and wind), energy efficiency programs, and gas distribution. They also provide digital solutions like the Energisa Digital Labs for AI and data analytics in the energy sector. The company is strongly committed to sustainability, social mobility, and environmental impact mitigation, exemplified by programs like Luz Para Todos and their initiatives in decarbonization and renewable energy generation. Additional services include customer support, energy consumption monitoring, negotiated billing, and services tailored for large clients. Energisa also supports cultural development through the Instituto Energisa and promotes innovation via research and development, open innovation challenges, and infrastructure investments. Their product and service portfolio includes electricity distribution and transmission, centralized and distributed renewable energy generation, natural gas distribution, financial services such as credit and debt negotiation, and digital customer engagement platforms.",['Energy'],['Mining and oil and gas services'],"['Oil and gas exploration services', 'Oil and gas extraction and production enhancement services', 'Oil and gas data management and processing services']","['Other logging services', 'Other oilfield pumping services', 'Oilfield information management and communications services', 'Oilfield data management services']","['General well logging services', 'Oilfield data and message transmission services', 'Oilfield satellite well data transmission services', 'Oilfield well data transmission services', 'Oilfield asset data management services']"
Refinaria de Manguinhos,rpmg3,https://www.infomoney.com.br,"InfoMoney is a leading digital ecosystem in Brazil specializing in financial markets, investments, and business communication. Established in 2000 and part of the XP Inc. group, InfoMoney aims to democratize access to quality financial information to improve people's lives. Its offerings include news and analysis across various formats and platforms, covering markets, where to invest, politics, economy, and more. The company also provides educational content such as courses, ebooks, and financial tools like investment simulators and fund comparators. Additionally, InfoMoney hosts brands like Stock Pickers and Zero ao Topo, focusing on the financial sector and entrepreneurship. It offers customized solutions and special projects for various businesses and brands, accompanied by advertising and sponsored content services. InfoMoney operates with a dedicated customer service team and maintains strict policies on data privacy and user information, adhering to relevant laws such as Brazil's LGPD. Despite being part of XP Inc., its editorial content is produced independently to ensure unbiased and high-quality financial journalism.","['Financials', 'Communication Services']","['Financial Instruments, Products, Contracts and Agreements', 'Financial and Insurance Services']","['Banking and investment', 'Insurance and retirement services']","['Investment advice', 'Securities and commodities markets services', 'Funds transfer and clearance and exchange services']","['Investment analysis', 'Investment policy', 'Financial asset management service', 'Market data', 'Education and training in investments']"
ATOM EDUCAÇÃO E EDITORA S.A.,ated3,https://www.atomeducacional.com.br,"Atom Educacional is a Brazilian company focused on financial education and trading services. It operates the largest proprietary trading desk (Mesa Proprietária) in Latin America and offers educational content and courses aimed at helping individuals achieve financial independence through knowledge. Its key offerings include proprietary trading operations, educational courses and materials through the Atom Play platform, live trading rooms, evaluation and training programs for traders, and partnerships with brokers such as BTG Pactual. Atom also provides investment strategies, copy trading, and solutions for both beginner and experienced traders. The company is led by well-known traders Kim Paiffer and Carol Paiffer and continues to grow through acquisitions, such as the purchase of a professional course franchise network. Atom emphasizes compliance with data protection laws and offers various customer support channels including WhatsApp, email, and chat.",['Financials'],"['Financial Instruments, Products, Contracts and Agreements', 'Financial and Insurance Services']","['Bank offered products', 'Securities', 'Banking and investment', 'Insurance and retirement services']","['Investment accounts', 'Securities and commodities markets services', 'Investment advice']","['Education savings account', 'Stock market trading services', 'Investment advisers', 'Investment analysis', 'Financial asset management service']"
WLM,wlmm4,https://www.wlm.com.br,"WLM Participações e Comércio de Máquinas e Veículos S.A. is a Brazilian company primarily focused on the commercialization and maintenance services of Scania brand heavy trucks, buses, and spare parts. It operates a network of concessionaires located across various states in Brazil, including Rio de Janeiro, São Paulo, Minas Gerais, Pará, and Amapá. The company also has activities in the agribusiness sector, through subsidiaries engaged in cattle raising, coffee production, and cultivation of soy and corn, emphasizing sustainable practices and environmental preservation. WLM's main business segments include automotive sales and after-sales services specializing in Scania vehicles, and agropecuary operations involving breeding, raising, and fattening cattle, as well as agricultural production. The company emphasizes customer satisfaction, innovation, sustainability, and ethical values, and holds certifications guaranteeing quality services. Its strategy focuses on consolidating national leadership in Scania vehicle sales and after-sales services, expanding its customer base, and investing in technology to enhance efficiency and competitiveness.","['Consumer Discretionary', 'Industrials']","['Vehicles and their Accessories and Components', 'Farming and Fishing and Forestry and Wildlife Machinery and Accessories']","['Motor vehicles', 'Transportation components and systems', 'Agricultural and forestry and landscape machinery and equipment']","['Truck tractors', 'Passenger motor vehicles', 'Product and material transport vehicles', 'Agricultural machinery for soil preparation', 'Agricultural machinery for planting and seeding']","['Busses', 'Heavy trucks', 'Electric busses', 'Delivery trucks']"
Grazziotin,cgra4,https://www.grazziotin.com.br,"Grupo Grazziotin is a diversified Brazilian company offering a broad range of services and products primarily in retail and financial sectors. Their retail operations include multiple store brands such as Lojas Grazziotin, Tottal Casa & Lazer, Pormenos, Franco Giorgi, and GZT, providing a variety of consumer goods. They also offer gift cards. In financial services, they operate Grazziotin Financeira, which encompasses financial services, insurance (Grazziotin Seguros), and credit services (Grazziotin Crédito). Additionally, the group is involved in agriculture through Floresta Piratini and Grato Agropecuária. They have a strong commitment to social responsibility through initiatives like the Compra Solidária social project and emphasize governance, ESG practices, and community engagement. The company also maintains resources for investors and shareholders, including financial reports and corporate governance documents.","['Consumer Discretionary', 'Financials']","['Financial and Insurance Services', 'Retail and Consumer Goods', 'Organizations and Clubs']","['Banking and investment', 'Insurance and retirement services', 'Civic organizations and associations and movements']","['Insurance services for structures and property and possessions', 'Life and health and accident insurance', 'Funds transfer and clearance and exchange services', 'Investment advice']","['Homeowners or renters insurance', 'Liability insurance', 'Life insurance', 'Health or hospitalization insurance', 'Professional indemnity insurance', 'Accidental injury insurance']"
Hotéis Othon,hoot4,https://www.ciahoteisothon.com.br,"Hotéis Othon S.A. is a Brazilian hotel company founded in 1943, operating primarily in the state of Rio de Janeiro. The company manages and owns hotels with a focus on providing unique and high-quality hospitality experiences. Currently, the company operates two owned hotels: Rio Othon Palace and Savoy Othon, both located in the prime area of Copacabana, Rio de Janeiro. Their services include hotel accommodation with emphasis on customer satisfaction, quality, and operational efficiency. The company previously operated additional hotels but has consolidated due to factors such as the COVID-19 pandemic. Hotéis Othon follows strong corporate governance practices and is listed on the Brazilian stock exchange with shares available to investors. Main products/services include hotel lodging, hospitality services, and associated event hosting and entertainment services within their hotel premises.",['Consumer Discretionary'],['Travel and Food and Lodging and Entertainment Services'],['Hotels and lodging and meeting facilities'],"['Hotels and motels and inns', 'Hotel rooms', 'Specialized accommodation services']",['Hotels']
Nutriplant,nutr3,https://www.nutriplant.com.br,"Nutriplant is a Brazilian company specializing in the development and manufacture of special fertilizers and micronutrients to enhance agricultural productivity and profitability. Established in 1965, it is a pioneer and leader in the Brazilian market for agricultural micronutrients. Nutriplant offers a broad portfolio of products including micronutrient fertilizers (FTE), amino acids and physiological products (Supremus), adjuvants (TechNutri), foliar fertilizers for coffee (Original Café), biostimulants, inoculants, biodefensives, micronutrients for sugarcane (ATR POWER), and micronutrient salts under the Quirios brand for industrial uses. The company designs nutritional programs for key crops like soybean, coffee, sugarcane, and cotton, providing solutions from seed treatment through crop maturity using both foliar and soil applications, as well as fertigation. Nutriplant collaborates with leading agronomic research institutions, emphasizing continuous innovation, quality, and a strong technical sales force to support high-tech farmers and maximize crop yield and quality.","['Consumer Staples', 'Industrials']","['Farming and Fishing and Forestry and Wildlife Machinery and Accessories', 'Food and Beverage Products', 'Humanitarian Relief Items, Kits, or Accessories']",['Agricultural and forestry and landscape machinery and equipment'],['Agricultural protection materials'],['Plastic film for agriculture']
Banestes,bees4,https://www.banestes.com.br,"Banestes S.A. - Banco do Estado do Espírito Santo is a publicly traded multiple bank controlled by the State of Espírito Santo, Brazil, established in 1937. It has the largest banking network in the state with agencies in all 78 municipalities and a comprehensive portfolio of financial products and services for individuals and businesses. The bank offers traditional banking services including internet banking, corporate banking, credit products (such as housing, rural, microcredit, and green credit for renewable energy and electric vehicles), investment options (including CDB and private pension), insurance (life, auto, personal accident, residential), capital management, and securities distribution through its subsidiaries. Banestes also promotes social, cultural, and environmental responsibility, supporting community projects and sustainable financing, and maintains strong governance and risk management practices. It operates related entities like Banescaixa (employee assistance), Fundação Banestes (social security), Banestes Administradora e Corretora de Seguros (insurance brokerage), Banestes Distribuidora de Títulos e Valores Mobiliários (securities distribution), and Banestes Seguros (insurance company).",['Financials'],"['Financial and Insurance Services', 'Financial Instruments, Products, Contracts and Agreements']","['Banking and investment', 'Insurance and retirement services', 'Securities', 'Credit agencies']","['Banking institutions', 'Insurance services for structures and property and possessions', 'Life and health and accident insurance', 'Pension funds', 'Investment advice', 'Securities and commodities markets services']","['Publicly owned banks', 'Life insurance', 'Car or truck insurance', 'Accidental injury insurance', 'Homeowners or renters insurance', 'Insurance broking fees and commission']"
Minupar,mnpr3,https://www.minupar.com.br,"Minupar Participações S.A. is a holding company primarily engaged in owning shares of other companies. Its main operation is through its indirect subsidiary, Companhia Minuano de Alimentos, which is vertically integrated within the poultry industry. This subsidiary handles activities ranging from the breeding of parent poultry stock to the production and slaughter of birds, offering services primarily to third parties. Minupar provides integrated poultry production and processing services, managing the entire supply chain from farm to final product. Key services include poultry breeding, production, slaughtering, and related service provision to other companies. The company is headquartered in Lajeado, Rio Grande do Sul, Brazil, and is publicly listed under the ticker MNPR3.",['Consumer Staples'],"['Food and Beverage Products', 'Live Plant and Animal Material and Accessories and Supplies']",['Meat and poultry products'],['Minimally processed meat and poultry products'],"['Chicken, minimally processed without additions']"
Pettenati,ptnt4,https://www.pettenati.com.br,"Pettenati is a leading textile company based in the Americas, specializing in the production of circular knit fabrics and ready-made textile solutions. Established over 60 years ago, it operates with three main manufacturing units, including facilities in Brazil and El Salvador, focusing on sustainable and innovative textile production. Pettenati offers a wide range of textile products such as over 200 patterns including plain, printed, and jacquard fabrics in natural (100% cotton), stretch cotton, microfiber stretch, synthetics, softs, fleeces, plush, piquets, and technological fabrics. Their products cater to various fashion segments including women's, men's, children's, infant fashion, casual, sport/activewear, streetwear, and intimate apparel. The company emphasizes sustainability, integrating ESG principles into their operations and supply chain, using eco-friendly materials like recycled polyester from PET bottles, recycled cotton, and Modal®. They also provide private label full-package garment manufacturing for major national and international sports brands, with a capacity of producing around 200,000 items per month. Pettenati is committed to continuous innovation, quality, and customer service, leveraging advanced technologies like automation, artificial intelligence, and lean manufacturing. They maintain a strong focus on social responsibility, employee development via their corporate university (UNIPETTE), workplace safety, and community engagement. Their global presence spans Brazil, Mercosur, Central America, North America, Europe, South Africa, and Israel. Major services and product categories include textile fabric production, eco-friendly textiles, private label garment manufacturing, textile design and development, and personalized client services such as training and factory visits.",['Consumer Discretionary'],"['Apparel and Luggage and Personal Care Products', 'Furniture and Furnishings']",['Clothing'],"['Athletic wear', 'Tshirts', 'Dresses and skirts and saris and kimonos']","['Womens athletic wear', 'Mens athletic wear', 'Boys athletic wear', 'Girls athletic wear', 'Infants dresses or skirts or saris or kimonos']"
Döhler,dohl4,https://www.infomoney.com.br,"InfoMoney is a leading digital ecosystem in Brazil specializing in financial markets, investments, and business communication. Established in 2000 and part of the XP Inc. group, InfoMoney aims to democratize access to quality financial information to improve people's lives. Its offerings include news and analysis across various formats and platforms, covering markets, where to invest, politics, economy, and more. The company also provides educational content such as courses, ebooks, and financial tools like investment simulators and fund comparators. Additionally, InfoMoney hosts brands like Stock Pickers and Zero ao Topo, focusing on the financial sector and entrepreneurship. It offers customized solutions and special projects for various businesses and brands, accompanied by advertising and sponsored content services. InfoMoney operates with a dedicated customer service team and maintains strict policies on data privacy and user information, adhering to relevant laws such as Brazil's LGPD. Despite being part of XP Inc., its editorial content is produced independently to ensure unbiased and high-quality financial journalism.","['Financials', 'Communication Services']","['Financial Instruments, Products, Contracts and Agreements', 'Financial and Insurance Services']","['Banking and investment', 'Securities', 'General agreements and contracts']","['Investment advice', 'Securities and commodities markets services', 'Funds transfer and clearance and exchange services']","['Investment advisers', 'Investment analysis', 'Market data', 'Financial asset management service', 'Investment policy']"
