Nome,ticker,valor,resumo_final,tag1,tag2,tag3,tag4,tag5
YDUQS,yduq3,https://www.yduqs.com.br,"YDUQS is a Brazilian company focused on higher education. It operates multiple universities and educational institutions, offering a wide range of undergraduate and postgraduate programs. Their services include the management and delivery of higher education courses, expansion through acquisitions such as the acquisition of Centro Universitário Unifametro, and initiatives in digital transformation and ESG (Environmental, Social, and Governance) practices. The company also engages in investor relations and provides various investor information and reports, highlighting its strong business governance and strategy.",['Consumer Discretionary'],['Education and Training Services'],"['Educational institutions', 'Vocational training']",['University and colleges'],"['Undergraduate programs', 'Postgraduate programs']"
Fleury,flry3,https://www.fleury.com.br,"Grupo Fleury is a Brazilian healthcare company specializing in clinical laboratory and diagnostic medicine services. Founded in 1926, it offers a comprehensive range of healthcare solutions including clinical analyses, pathological anatomy, diagnostic imaging (such as magnetic resonance and computed tomography), vaccine administration, health check-ups, and integrated medical diagnostics. The company also operates centers for infusion therapy and day clinics. Fleury emphasizes technological innovation, quality certifications (ISO 9001, ISO 14001, CAP accreditation), sustainability, and patient rights. It partners with international institutions for specialized tests unavailable in Brazil, facilitating sample collection and analysis without the need for patients to travel abroad. Their services cater to both individual patients and corporate clients, providing secure and accessible healthcare solutions through multiple units across Brazil.",['Health Care'],"['Healthcare Services', 'Laboratory and Measuring and Observing and Testing Equipment', 'Medical Equipment and Accessories and Supplies']","['Comprehensive health services', 'Medical science research and experimentation', 'Diagnoses of symptoms, signs and abnormal clinical and laboratory findings, not elsewhere classified', 'Medical diagnostic imaging and nuclear medicine products']","['Healthcare centers', 'Healthcare provider support persons', 'Health administration services', 'Medical science and research', 'Medical imaging processing equipment and supplies']","['Private specialized clinic services', 'Medical office services', 'Urgent care centers', 'Medical imaging wet darkroom or daylight processors', 'Health service planning']"
Banco Santander,sanb11,https://www.santander.com.br,"Banco Santander Brasil is the third largest private bank in Brazil and the only international bank with retail scale in the country. It operates as part of the global Grupo Santander, headquartered in Spain, which has a presence in Europe and the Americas. Banco Santander Brasil provides a broad range of financial products and services for individuals, small and medium enterprises, and large corporations, including retail banking, wholesale banking, investment products, credit, financing, loans, insurance, pensions, consortia, and digital banking solutions. The bank emphasizes digital transformation combined with personalized customer service. Additionally, it is strongly committed to sustainability, social impact initiatives, education, microcredit, technological innovation, and cultural investments in Brazil.",['Financials'],['Financial and Insurance Services'],"['Banking and investment', 'Insurance and retirement services']","['Banking institutions', 'Investment advice', 'Insurance services for structures and property and possessions', 'Pension funds']","['Privately owned banks', 'Financial asset management service', 'Insurance broking fees and commission']"
Helbor,hbor3,https://www.helbor.com.br,"Helbor Empreendimentos S.A. is a Brazilian pure real estate developer with over 47 years of market experience. The company manages the entire process of real estate development, from land acquisition to delivery of keys. Helbor specializes in residential, commercial, condominium houses, urban lots, and hotel units, mainly in São Paulo, Greater São Paulo, Curitiba (PR), and Joinville (SC). It has developed 275 projects totaling over 10 million square meters, delivering more than 45,000 units across 30 cities in 10 states and the Federal District. The company emphasizes sustainability, social responsibility, and transparency (ESG practices) and is the only pure developer in Brazil certified with the international green AQUA label. Helbor provides services including project development, property sales, customer portals for contract and financial management, customization of units through the Helbor Personalize system, and strong post-sales support. Their portfolio features various residential projects offering amenities such as solarium spaces designed for resident well-being.",['Real Estate'],['Land and Buildings and Structures and Thoroughfares'],"['Permanent buildings and structures', 'Land parcels']","['Residential land parcel', 'Commercial land parcels', 'Accommodation buildings and structures']","['Residential home', 'Condominium parcel', 'Housing subdivision parcel', 'Apartment building parcel', 'Hotel parcel']"
Méliuz,cash3,https://www.meliuz.com.br,"Méliuz is a Brazilian company that provides online cashback and discount coupon services to consumers. It offers users the ability to earn cashback on purchases made at over 800 partner online stores, including major retailers such as Amazon, Magazine Luiza, Casas Bahia, AliExpress, and others. The company provides discount coupons, a browser extension that automatically applies coupons and activates cashback, and a mobile app to facilitate cashback earning and coupon use during purchases. Additionally, Méliuz offers a free credit card with cashback benefits, digital accounts allowing instant cashback redemption, bill payments, and other financial services. Users can also earn cashback by submitting receipts (including from physical stores) through the app. Méliuz positions itself as a platform that helps consumers save money via cashback rewards and discounts while also offering services for partnerships with retailers to run cashback loyalty programs.","['Consumer Discretionary', 'Financials']","['Financial and Insurance Services', 'Financial Instruments, Products, Contracts and Agreements']","['Bank offered products', 'Development finance', 'Banking and investment']","['Card based revolving credit products', 'Cash vault services', 'Electronic fund transfer and payment products', 'Demand deposit accounts']","['Secured credit card', 'Bill paying application', 'Money transfer application']"
Smart Fit,smft3,https://www.investor.smartfit.com.br,"Smart Fit is the leading fitness gym network in Latin America and the fourth largest globally by number of customers. Established in 1996 with the premium brand Bio Ritmo, Smart Fit pioneered the High Value Low Price (HVLP) gym model in Latin America in 2009, offering high-quality fitness services at affordable prices. The company operates over 1,500 gyms across 15 Latin American countries, including Brazil, Mexico, Colombia, Chile, and Peru. Their main products and services include HVLP gyms under the Smart Fit brand, premium gyms primarily under the Bio Ritmo brand, and various specialized fitness studios such as Race Bootcamp (HIIT workouts), Tonus Gym (muscle training), Vidya Body & Mind (yoga), Jab House (boxing and functional training), and One Pilates. Additionally, Smart Fit offers a corporate fitness benefits platform called TotalPass in Brazil and Mexico, enabling employees access to multiple gyms and studios, including Smart Fit and Bio Ritmo locations. The company focuses on innovation, customer experience, convenience, and digital fitness solutions like Smart Fit App and Smart Fit GO for on-demand training.",['Consumer Discretionary'],"['Sports and Recreational Equipment and Supplies and Accessories', 'Education and Training Services']",['Fitness equipment'],['Weight and resistance training equipment'],"['Fitness weights', 'Upper body resistance machines', 'Lower body resistance machines', 'Multi gyms']"
Oncoclínicas,onco3,https://www.grupooncoclinicas.com,"Oncoclínicas&Co is one of the largest oncology, hematology, and radiotherapy groups in Latin America, founded in 2010 in Brazil. It offers specialized, humanized cancer treatment with a multidisciplinary team of over 2,900 oncology specialists. The company operates more than 140 units across 40 Brazilian cities, providing comprehensive cancer care that includes clinics, genomics laboratories, and cancer centers. Its main services include diagnostics (pathological analysis, genetic testing, molecular diagnostics, and precision medicine), treatments (chemotherapy, radiotherapy, surgeries, hormone therapy, immunotherapy, targeted therapy, bone marrow transplant, cellular therapy), as well as support therapies such as integrative medicine, cryotherapy, laser therapy, and palliative care. Oncoclínicas&Co also emphasizes patient-centered care, research, education, and runs programs to support patients and promote cancer prevention and awareness. It integrates advanced technology and clinical expertise to offer personalized and precise oncology services throughout the patient journey.",['Health Care'],['Healthcare Services'],"['Comprehensive health services', 'Medical practice', 'Disease prevention and control', 'Diagnoses of neoplasms']","['Oncology', 'Medical doctor specialist services', 'Healthcare provider specialist services', 'Disease prevention and control']","['Oncology services', 'Surgery services']"
Lojas Quero-Quero,ljqq3,https://www.infomoney.com.br,"InfoMoney is a leading digital ecosystem in Brazil specializing in financial markets, investments, and business communication. Established in 2000 and part of the XP Inc. group, InfoMoney aims to democratize access to quality financial information to improve people's lives. Its offerings include news and analysis across various formats and platforms, covering markets, where to invest, politics, economy, and more. The company also provides educational content such as courses, ebooks, and financial tools like investment simulators and fund comparators. Additionally, InfoMoney hosts brands like Stock Pickers and Zero ao Topo, focusing on the financial sector and entrepreneurship. It offers customized solutions and special projects for various businesses and brands, accompanied by advertising and sponsored content services. InfoMoney operates with a dedicated customer service team and maintains strict policies on data privacy and user information, adhering to relevant laws such as Brazil's LGPD. Despite being part of XP Inc., its editorial content is produced independently to ensure unbiased and high-quality financial journalism.","['Financials', 'Information Technology']","['Financial and Insurance Services', 'Financial Instruments, Products, Contracts and Agreements']","['Development finance', 'Banking and investment', 'Securities']","['Investment advice', 'Securities and commodities markets services', 'Development assistance']","['Investment advisers', 'Investment policy', 'Investment analysis', 'Market data', 'Financial asset management service', 'Savings mobilization programs']"
Light,ligt3,https://www.light.com.br,"Light is a company providing electricity services primarily focused on residential and business customers. Their main offerings include online services for home and company energy needs, customer self-service options through their app, and informational content such as tips and news updates related to their services. They emphasize customer engagement through social media and digital platforms to facilitate easy access to their services.",['Utilities'],['Public Utilities and Public Sector Related Services'],['Utilities'],['Electric utilities'],"['Supply of single phase electricity', 'Municipal electric power distribution']"
Auren Energia,aure3,https://www.statusinvest.com.br,"Status Invest is a financial investment platform that provides comprehensive tools, information, and services related to various investment assets primarily in the Brazilian and international markets. The company offers detailed data, analytics, and insights on stocks, real estate investment trusts (REITs), exchange-traded funds (ETFs), fixed income, cryptocurrencies, and other financial instruments. Its services include advanced search and analysis functionalities for stocks, IPOs, FIIs (Brazilian real estate funds), investment funds (FIAs, FIDCs, FIPs, FI-Infra, Fiagros), BDRs, Treasury bonds, and market indexes. Status Invest also offers personalized financial advisory services with several tiers of investment advisory plans (on-demand, exclusive, premium, private), designed to provide portfolio mapping, goal alignment, continuous monitoring by dedicated advisors, and fixed transparent fees. The advisory service emphasizes client-aligned interests and certified professional support to enhance investment strategies and growth. In addition, the platform features real-time data updates, dividend information, event calendars, and educational content like investment courses. Overall, Status Invest operates as a comprehensive investment management and advisory platform aiming to centralize investment tracking, provide research tools, and offer tailored financial advice to help investors make informed decisions and grow their wealth.",['Financials'],"['Financial Instruments, Products, Contracts and Agreements', 'Financial and Insurance Services']","['Banking and investment', 'Securities', 'Development finance']","['Investment advice', 'Securities and commodities markets services', 'Funds transfer and clearance and exchange services']","['Investment advisers', 'Investment analysis', 'Market data', 'Financial asset management service', 'Investment policy']"
Iguatemi,igti11,https://www.jereissati.com.br,"Iguatemi S.A. is a Brazilian company specializing in the development, ownership, and management of shopping centers. Founded in 1979, it operates premium shopping malls located in high-income regions such as São Paulo, Rio de Janeiro, Rio Grande do Sul, Brasília, and Santa Catarina. The company is recognized for pioneering the shopping center sector in Brazil and for hosting luxury brands. Its main services and products include the development and operation of shopping centers, multi-use complexes combining retail, commercial towers, residential projects, and hotels, as well as acquisition and expansion of existing shopping centers. Iguatemi S.A. also operates a digital marketplace, Iguatemi 365, enhancing the omnichannel retail experience. The company is listed on the Brazilian stock exchange B3 under the ticker IGTI11 and is committed to sustainability practices and corporate governance standards.","['Consumer Discretionary', 'Real Estate']","['Land and Buildings and Structures and Thoroughfares', 'Travel and Food and Lodging and Entertainment Services', 'Organizations and Clubs']","['Permanent buildings and structures', 'Travel facilitation', 'Hotels and lodging and meeting facilities', 'Civic organizations and associations and movements']","['Commercial and entertainment buildings and structures', 'Accommodation buildings and structures']","['Shopping mall', 'Shopping center']"
Sabesp,sbsp3,https://www.sabesp.com.br,"Sabesp is a Brazilian sanitation company that provides comprehensive water supply and sewage services. Their main offerings include water resource management, water capture (surface and underground), water treatment, and distribution to homes and businesses. They also manage sewage collection and treatment, covering domestic and non-domestic sewage. Sabesp supports sustainability initiatives through various programs focused on water conservation, pollution reduction, and environmental care, including biogas and solar power innovations. Additionally, Sabesp offers customer services like billing, social tariffs, and support for large clients and real estate developers. The company promotes transparency, sustainability, governance, and invests in research and technological innovation in sanitation and water management.",['Utilities'],['Public Utilities and Public Sector Related Services'],['Utilities'],['Water and sewer utilities'],"['Supply of water', 'Water resource management', 'Water treatment services', 'Water distribution management', 'Sewage collection and treatment', 'Water quality control management']"
Energisa,engi11,https://www.energisa.com.br,"Energisa is a leading Brazilian energy company with over 120 years of history, providing energy distribution, transmission, generation, and innovative energy solutions across various Brazilian states. Their services span residential and commercial customers, offering electricity supply, renewable energy projects (solar and wind), energy efficiency programs, and gas distribution. They also provide digital solutions like the Energisa Digital Labs for AI and data analytics in the energy sector. The company is strongly committed to sustainability, social mobility, and environmental impact mitigation, exemplified by programs like Luz Para Todos and their initiatives in decarbonization and renewable energy generation. Additional services include customer support, energy consumption monitoring, negotiated billing, and services tailored for large clients. Energisa also supports cultural development through the Instituto Energisa and promotes innovation via research and development, open innovation challenges, and infrastructure investments. Their product and service portfolio includes electricity distribution and transmission, centralized and distributed renewable energy generation, natural gas distribution, financial services such as credit and debt negotiation, and digital customer engagement platforms.",['Energy'],['Mining and oil and gas services'],['Oil and gas data management and processing services'],['Oilfield information management and communications services'],"['Oilfield real time well data monitoring services', 'Oilfield well data transmission services', 'Oilfield satellite well data transmission services']"
Bradespar,brap4,https://www.bradespar.com.br,"Bradespar is a company focused on investments, primarily in the mining and logistics sectors. They hold significant stakes in companies such as Vale, a major mining corporation. Their main business activity is managing and developing their investment portfolio to generate value for shareholders.","['Financials', 'Materials']","['Financial Instruments, Products, Contracts and Agreements', 'Financial and Insurance Services', 'Mineral and Textile and Inedible Plant and Animal Materials']","['Securities', 'Development finance', 'Banking and investment', 'Minerals and ores and metals']","['Equity based securities', 'Minerals', 'Ores', 'Base Metals', 'Precious metals']","['Common or ordinary stock', 'Preferred stock', 'Preference stock']"
Hypera,hype3,https://www.hypera.com.br,"Hypera Pharma is one of the largest pharmaceutical companies in Brazil, operating across all key sectors of the pharmaceutical industry. Headquartered in São Paulo and publicly listed since 2008, it employs over 3,400 people and focuses on sustainable growth through innovation, social responsibility, and high-quality products. The company offers a diverse portfolio including prescription drugs, over-the-counter medications, generics, similar medicines, skincare products, and nutritional items. Hypera Pharma invests heavily in research and development at its Brainfarma subsidiary's Hynova center, which develops medicines, dermocosmetics, and health products. Additionally, the company emphasizes corporate social responsibility, environmental sustainability, diversity, inclusion, and employee wellbeing. Hypera Pharma also engages in compliance, ethics, and governance to maintain trust and integrity in its operations.",['Health Care'],['Pharmaceutical Products incl. Contraceptives and Vaccines'],"['Antidepressants', 'Antibiotics', 'Antihistamines or H1 blockers', 'Antifungal drugs', 'Immunomodulating drugs', 'Herbal drugs', 'Antiseptics']","['Antidepressants, synthesized']","['Clodazon', 'Dazadrol', 'Fantridone', 'Beloxepin']"
Intelbras,intb3,https://www.investidor10.com.br,"Investidor10 is a Brazilian online financial platform aimed at investors interested in long-term investment strategies, particularly in the 'Buy and Hold' approach. The platform offers comprehensive tools, educational content, and financial analysis to assist investors in managing and optimizing their portfolios. Key services and products include a portfolio manager with integration to B3 (the Brazilian Stock Exchange), advanced filtering and comparison tools for assets like stocks, real estate funds (FIIs), cryptocurrencies, and international investments. It provides extensive market data, rankings, dividend schedules, tax assistance tools (IRPF), and a wide range of investment courses covering stocks, fixed income, cryptocurrencies, real estate funds, and financial literacy. Investidor10 also offers a PRO subscription with enhanced features such as exclusive reports, recommended portfolios, and integration capabilities to facilitate investment decisions and reporting. The platform's content is informational and educational, designed to empower investors with knowledge and tools needed for making well-informed long-term investment decisions.","['Financials', 'Consumer Discretionary']","['Financial Instruments, Products, Contracts and Agreements', 'Financial and Insurance Services', 'Education and Training Services']","['Bank offered products', 'Securities', 'Banking and investment', 'Educational institutions', 'Specialized educational services']","['Investment accounts', 'Investment advice', 'Securities and commodities markets services']","['Education savings account', 'Investment analysis', 'Financial asset management service', 'Investment advisers', 'Investment policy']"
Construtora Tenda,tend3,https://www.tenda.com,"Construtora Tenda is one of Brazil's largest construction companies specializing in affordable residential apartments. Founded in 1969 and headquartered in Brazil, the company focuses on making home ownership accessible for low-income families, particularly through strong partnerships with government housing programs like Minha Casa Minha Vida. Tenda offers a comprehensive real estate solution including property development, construction, financing facilitation, and post-sale services via its own sales stores and a virtual sales platform. It operates in multiple states across Brazil, providing apartments equipped with safety and leisure amenities in gated communities. Additionally, Tenda runs Alea, a startup producing off-site wood-frame houses targeting interior cities. The company supports customers through financing simulations, subsidies, and financial guidance. Tenda is publicly traded on Brazil's B3 stock exchange and emphasizes operational efficiency, customer service, and social impact.",['Real Estate'],['Land and Buildings and Structures and Thoroughfares'],"['Permanent buildings and structures', 'Prefabricated buildings and structures']","['Accommodation buildings and structures', 'Prefabricated residential buildings and structures']","['Flat or apartment', 'Prefabricated living quarters']"
C&A,ceab3,https://www.cea.com.br,"C&A is a retail fashion company offering a wide range of clothing and accessories for women, men, and children. Their product categories include women's, men's, and children's apparel, jeans, beauty products, footwear, sportswear, and accessories. They feature a special brand called Mindse7, which focuses on trendy, innovative fashion with a community-driven approach embracing diversity, sustainability, and creativity. C&A also provides online shopping with services such as returns, exchanges, and a loyalty program called C&A Pay that offers discounts and payment benefits. Customer support is available via phone and WhatsApp.",['Consumer Discretionary'],['Apparel and Luggage and Personal Care Products'],"['Clothing', 'Footwear', 'Personal care products']","['Slacks and trousers and shorts', 'Shirts and blouses', 'Sweaters', 'Coats and jackets', 'Suits', 'Dresses and skirts and saris and kimonos', 'Athletic wear', 'Tshirts', 'Footwear', 'Clothing accessories']","['Womens slacks or trousers or shorts', 'Mens slacks or trousers or shorts', 'Girls slacks or trousers or shorts', 'Boys slacks or trousers or shorts', 'Womens shirts or blouses', 'Mens shirts', 'Girls shirts or blouses', 'Boys shirts', 'Womens dresses or skirts or saris or kimonos', 'Mens athletic wear', 'Boys athletic wear', 'Girls athletic wear']"
